{
  "schema_version": "native-ppo-parallel-runner-config/1.0",
  "runner_id": "native-parallel-ppo-runner",
  "runner_version": "1.0.0",
  "purpose": "BASELINE_V1",
  "base_vector_runner_ref": {
    "id": "native-synchronous-vector-ppo-runner",
    "version": "1.0.0",
    "hash": "82dde8211ff11c7d25d6ab4b60d45b22d82ac862380469dc0741334430e5f263"
  },
  "worker_protocol_ref": {
    "id": "native-ppo-parallel-worker-protocol",
    "version": "1.0.0",
    "hash": "38badec22a6c63597b702e2eb41c02d6d6d1294343f54209386b4ed9696976bd"
  },
  "num_envs": 4,
  "num_workers": 4,
  "execution_mode": "SYNCHRONOUS_MULTIPROCESS",
  "start_method": "SPAWN",
  "trained_side": "RED",
  "reward_mode": "BASE_ONLY",
  "ppo_config_ref": {
    "id": "native-masked-ppo",
    "version": "1.0.0",
    "hash": "8d864eb27030280186719951abbdd7e909af1bf0ab25c99a7fa07ebedf64e8db"
  },
  "seed_config_ref": {
    "id": "native-training-seeds",
    "version": "1.0.0",
    "hash": "0bf9ddec709ab6048855f6bf86e2338fe5f3b8ef15fdca99a98e9fdf092aa1f3"
  },
  "rollout_target_semantics": "TOTAL_TRANSITIONS_PER_UPDATE",
  "aggregation_order": "STABLE_ENV_INDEX",
  "failure_policy": "FAIL_WHOLE_ROLLOUT",
  "auto_restart": false,
  "operational": {"worker_timeout_seconds": 30.0}
}
